[
  {
    "fixture_id": "fdo:560603",
    "kickoff_utc": "2026-10-17T11:30:00Z",
    "home": "Everton",
    "away": "Chelsea",
    "p_home": 0.35565372321679195,
    "p_draw": 0.2826260334669493,
    "p_away": 0.36172024331625874,
    "p_over_2_5": 0.5079916148950455,
    "p_btts": 0.5623894484295552,
    "xg_home": 1.346711397991309,
    "xg_away": 1.359888425222115,
    "top_scorelines": [
      {
        "home_goals": 1,
        "away_goals": 1,
        "probability": 0.13467790049514858
      },
      {
        "home_goals": 1,
        "away_goals": 2,
        "probability": 0.08313618987982313
      },
      {
        "home_goals": 2,
        "away_goals": 1,
        "probability": 0.08233060785606076
      },
      {
        "home_goals": 0,
        "away_goals": 0,
        "probability": 0.07917214428238374
      },
      {
        "home_goals": 0,
        "away_goals": 1,
        "probability": 0.07838167506235853
      }
    ],
    "scoreline_matrix": [
      [
        0.07917214428238374,
        0.07838167506235853,
        0.06173265710717797,
        0.02798321809963093,
        0.009513528153971943,
        0.0025874713226813756,
        0.0005864462809645886
      ],
      [
        0.07750192222971553,
        0.13467790049514858,
        0.08313618987982313,
        0.037685371769116925,
        0.01281199481924925,
        0.0034845820230541107,
        0.000789775001648506
      ],
      [
        0.060542085928170015,
        0.08233060785606076,
        0.055980305980789825,
        0.0253756955386644,
        0.008627041860381598,
        0.0023463664638433365,
        0.0005318002462245654
      ],
      [
        0.02717761061597369,
        0.03695857464744736,
        0.02512980738579181,
        0.011391262158980715,
        0.0038727173148168956,
        0.0010532943016263335,
        0.00023872748676875724
      ],
      [
        0.00915011236567512,
        0.012443150933238115,
        0.008460661408277725,
        0.0038351910406823754,
        0.001303859971054364,
        0.0003546213591102686,
        8.03743699023149e-05
      ],
      [
        0.0024645155893217954,
        0.003351471351356102,
        0.0022788170356130124,
        0.0010329805504078753,
        0.0003511851107982598,
        9.551465959175198e-05,
        2.1648246457523843e-05
      ],
      [
        0.0005531659837674935,
        0.0007522451694662013,
        0.0005114855320018029,
        0.00023185477294396188,
        7.88242761136985e-05,
        2.143847694297946e-05,
        4.8589968756548735e-06
      ]
    ]
  },
  {
    "fixture_id": "fdo:560602",
    "kickoff_utc": "2026-10-17T14:00:00Z",
    "home": "Fulham",
    "away": "Hull City",
    "p_home": 0.4190474507380082,
    "p_draw": 0.30095560998633675,
    "p_away": 0.27999693927565494,
    "p_over_2_5": 0.4238512558466247,
    "p_btts": 0.4899866507024812,
    "xg_home": 1.3309124838169715,
    "xg_away": 1.0444866734397507,
    "top_scorelines": [
      {
        "home_goals": 1,
        "away_goals": 1,
        "probability": 0.14236712621151504
      },
      {
        "home_goals": 1,
        "away_goals": 0,
        "probability": 0.11062726955236155
      },
      {
        "home_goals": 0,
        "away_goals": 0,
        "probability": 0.1060946387908613
      },
      {
        "home_goals": 2,
        "away_goals": 1,
        "probability": 0.08601013047195363
      },
      {
        "home_goals": 0,
        "away_goals": 1,
        "probability": 0.08399605281554764
      }
    ],
    "scoreline_matrix": [
      [
        0.1060946387908613,
        0.08399605281554764,
        0.050716873649677086,
        0.01765770219451494,
        0.004610809347356566,
        0.0009631859277488386,
        0.00016767250272183167
      ],
      [
        0.11062726955236155,
        0.14236712621151504,
        0.06749980599050188,
        0.023500886127183564,
        0.006136591513024826,
        0.001281917803232773,
        0.00022315771042676638
      ],
      [
        0.08234678313341258,
        0.08601013047195363,
        0.04491822426030398,
        0.01563883122160732,
        0.004083638311711801,
        0.0008530612869759715,
        0.0001485018798983801
      ],
      [
        0.036532166945998076,
        0.038157367244787375,
        0.01992743377645531,
        0.006937980711431459,
        0.001811657369891807,
        0.0003784504526483338,
        6.588108559690561e-05
      ],
      [
        0.012155294696892244,
        0.012696045225117487,
        0.006630426015069796,
        0.0023084642165756273,
        0.0006027901179085121,
        0.00012592126787641016,
        2.192051765134329e-05
      ],
      [
        0.0032355307997295186,
        0.0033794693082290377,
        0.0017649055923400262,
        0.0006144735491039596,
        0.000160452382348593,
        3.351808003957998e-05,
        5.834865527782647e-06
      ],
      [
        0.0007177023001805445,
        0.0007496306003664977,
        0.0003914896447067769,
        0.00013630192598657433,
        3.559139164759618e-05,
        7.434947967132057e-06,
        1.2942842055108399e-06
      ]
    ]
  },
  {
    "fixture_id": "fdo:560610",
    "kickoff_utc": "2026-10-17T14:00:00Z",
    "home": "Manchester City",
    "away": "Ipswich Town",
    "p_home": 0.82498724033499,
    "p_draw": 0.12018793185045998,
    "p_away": 0.05482482781454996,
    "p_over_2_5": 0.7353596439435053,
    "p_btts": 0.5093577020246575,
    "xg_home": 3.0719463813607075,
    "xg_away": 0.7522082365072471,
    "top_scorelines": [
      {
        "home_goals": 3,
        "away_goals": 0,
        "probability": 0.10553717095368882
      },
      {
        "home_goals": 2,
        "away_goals": 0,
        "probability": 0.1029662659060364
      },
      {
        "home_goals": 4,
        "away_goals": 0,
        "probability": 0.08112920058016179
      },
      {
        "home_goals": 3,
        "away_goals": 1,
        "probability": 0.07938592984701101
      },
      {
        "home_goals": 2,
        "away_goals": 1,
        "probability": 0.07745207388032206
      }
    ],
    "scoreline_matrix": [
      [
        0.02689288067248622,
        0.011270531547203878,
        0.006161800873857966,
        0.001544985801315412,
        0.00029053776344752015,
        4.3708980065560814e-05,
        5.479709177050106e-06
      ],
      [
        0.061859292461752965,
        0.05548958459515725,
        0.018946953931505448,
        0.004750684970451693,
        0.0008933760976855745,
        0.00013440097280793115,
        1.6849586583704523e-05
      ],
      [
        0.1029662659060364,
        0.07745207388032206,
        0.029130044173094505,
        0.007303953107290752,
        0.0013735234319377373,
        0.00020663512926432856,
        2.5905441225860095e-05
      ],
      [
        0.10553717095368882,
        0.07938592984701101,
        0.029857375371754164,
        0.0074863212814312635,
        0.001407818142862382,
        0.00021179448210842185,
        2.6552259181461245e-05
      ],
      [
        0.08112920058016179,
        0.06102605335732372,
        0.022952150161341427,
        0.005754932175652962,
        0.0010822268539185335,
        0.0001628119918837474,
        2.0411420369932875e-05
      ],
      [
        0.049892921156011495,
        0.03752986651965148,
        0.01411513746187169,
        0.003539174246076052,
        0.0006655490095964172,
        0.0001001262901177325,
        1.2552636780797882e-05
      ],
      [
        0.02556933430132386,
        0.019233464008338755,
        0.0072337850763073905,
        0.0018137709188360666,
        0.00034108335864065504,
        5.1313142727526454e-05,
        6.433028148576198e-06
      ]
    ]
  },
  {
    "fixture_id": "fdo:560611",
    "kickoff_utc": "2026-10-17T14:00:00Z",
    "home": "Brentford",
    "away": "Liverpool",
    "p_home": 0.37080620394600655,
    "p_draw": 0.2601512108396213,
    "p_away": 0.3690425852143722,
    "p_over_2_5": 0.6002246748085313,
    "p_btts": 0.6325837182900568,
    "xg_home": 1.555239820394201,
    "xg_away": 1.5511669549976894,
    "top_scorelines": [
      {
        "home_goals": 1,
        "away_goals": 1,
        "probability": 0.11894306838716893
      },
      {
        "home_goals": 2,
        "away_goals": 1,
        "probability": 0.08397082790054251
      },
      {
        "home_goals": 1,
        "away_goals": 2,
        "probability": 0.08375091607699983
      },
      {
        "home_goals": 2,
        "away_goals": 2,
        "probability": 0.06512669356840091
      },
      {
        "home_goals": 1,
        "away_goals": 0,
        "probability": 0.058655109533091165
      }
    ],
    "scoreline_matrix": [
      [
        0.05572008911797899,
        0.05847279616035927,
        0.05385054544777264,
        0.027843860060720566,
        0.010797669781723498,
        0.0033498134945626544,
        0.0008660240801328199
      ],
      [
        0.058655109533091165,
        0.11894306838716893,
        0.08375091607699983,
        0.04330408852528325,
        0.016793046907822656,
        0.005209788434340222,
        0.0013468816230693308
      ],
      [
        0.05413371654509789,
        0.08397082790054251,
        0.06512669356840091,
        0.03367428364666619,
        0.013058670534899381,
        0.004051254730247116,
        0.0010473670121757196
      ],
      [
        0.028063772388351397,
        0.04353180146977456,
        0.03376270504514289,
        0.017457279712423536,
        0.006769820750817701,
        0.002100234343639991,
        0.0005429715769151042
      ],
      [
        0.010911526645446716,
        0.016925679309560758,
        0.013127339069901739,
        0.006787596838484616,
        0.002632186381974319,
        0.000816595954570322,
        0.0002111137714218549
      ],
      [
        0.003394024497824485,
        0.0052647234512268725,
        0.004083251761391903,
        0.00211127834809312,